{
  "version": "2.0",
  "id": "concept:growth-capital",
  "type": "Concept",
  "name": {
    "fa": "سرمایه رشد",
    "en": "Growth Capital"
  },
  "aliases": [],
  "lifecycleStatus": "PUBLISHED",
  "metadata": {
    "public_profile": {
      "text": "سرمایه رشد در چارچوب ECB، راهبرد سرمایه‌گذاری مالکانه برای تأمین مالی رشد بنگاه‌های نسبتاً بالغ است. جایگاه آن در این مدخل به همین چارچوب منتسب است.",
      "sourceRefs": [
        "source:ecb-private-markets-public-risk"
      ],
      "locators": [
        "Overview of private market segments and strategies; private equity paragraph"
      ],
      "origin": "editorial_synthesis",
      "reviewed_on": "2026-10-11"
    }
  }
}
