{
  "version": "2.0",
  "id": "person:ali-sanginian",
  "type": "Person",
  "name": {
    "fa": "علی سنگینیان",
    "en": "Ali Sanginian"
  },
  "honorific": {
    "fa": "دکتر"
  },
  "aliases": [],
  "domains": [
    "sector:capital-market",
    "sector:investment-banking",
    "sector:corporate-investment",
    "sector:private-equity"
  ],
  "lifecycleStatus": "PUBLISHED",
  "metadata": {
    "entity_role": "executive_and_board_member",
    "last_reviewed": "1405-06",
    "public_profile": {
      "text": "علی سنگینیان از مدیران بازار سرمایه ایران است. مصاحبهٔ بازار و سرمایه در آذر ۱۳۹۱ او را مدیرعامل تأمین سرمایه امین معرفی می‌کند؛ گزارش معاصر چیلان در ۹ تیر ۱۳۹۵ نیز این سمت را ذکر می‌کند. این شواهد تاریخ آغاز و پایان کامل دوره را تعیین نمی‌کنند.",
      "sourceRefs": [
        "source:sanginian-market-capital-interview-1391",
        "source:tehran-chamber-independent-report"
      ],
      "locators": [
        "صفحات چاپی ۶۴ و ۶۸؛ معرفی و انتقال به امین",
        "عنوان سمت‌ها در ابتدای گزارش، ۲۰۱۶/۰۶/۲۹"
      ],
      "origin": "sourced_profile",
      "reviewed_on": "2026-10-11"
    }
  }
}
