{
  "version": "2.0",
  "id": "organization:amin-investment-bank",
  "type": "Organization",
  "name": {
    "fa": "شرکت تأمین سرمایه امین",
    "en": "Amin Investment Bank"
  },
  "aliases": [
    "تأمین سرمایه امین",
    "Amin"
  ],
  "lifecycleStatus": "PUBLISHED",
  "metadata": {
    "public_profile": {
      "text": "تأمین سرمایه امین خدماتی مانند تأمین مالی از بازار سرمایه، مشاورهٔ مالی شرکتی، مدیریت دارایی و ارزش‌گذاری را در وب‌سایت خود معرفی می‌کند. این معرفی، تأیید همهٔ سوابق مدیریتی یا تاریخ‌های آن‌ها نیست.",
      "sourceRefs": [
        "source:amin-official-profile"
      ],
      "locators": [
        "خدمات"
      ],
      "origin": "sourced_profile",
      "reviewed_on": "2026-10-11"
    }
  }
}
