{
  "version": "2.0",
  "id": "investment:kayson-achareh",
  "type": "Investment",
  "name": {
    "fa": "سرمایه‌گذاری گروه کیسون در آچاره",
    "en": "Kayson Investment in Achareh"
  },
  "lifecycleStatus": "REVIEW",
  "investor": "organization:kayson-group",
  "target": "organization:achareh",
  "investment_status": "announced",
  "date_status": "unknown"
}
